{
  "schema_version": "0.1.0",
  "run_id": "RUN-OFS003-PILOT-005",
  "predecessor_run_id": "RUN-OFS003-PILOT-004",
  "evaluated_at": "2026-08-23T19:41:09.042135Z",
  "status": "passed",
  "publication_blocked": false,
  "maximum_age_days": 90,
  "predecessor_profile_count": 15,
  "current_profile_count": 15,
  "compared_field_count": 99,
  "regression_count": 0,
  "regressions": []
}
